[
  {
    "schemaVersion": 1,
    "reviewItemId": "76231edf85c2a7beca2e",
    "queueVersion": "2026-09-09T17:51:46Z",
    "inputHash": "974c8b029bb8e16302f19d33439398d17f9608e64d5f76f08103a597c5ca4484",
    "evidenceHash": "c1c5250262cc308ad9527832775189d79625e35bebecff25bb7a79bd8612cb6a",
    "source": "ebay-es",
    "capturedAt": "2026-09-07T21:36:07Z",
    "reason": "estado_desconocido",
    "triageBucket": "manual_match",
    "listing": {
      "id": "v1|143915168489|0",
      "url": "https://www.ebay.es/itm/143915168489?_skw=Monster+Max&hash=item21820332e9:g:x4gAAOSwGB1f~DO2",
      "title": "MONSTER MAX NINTENDO GAME BOY FRIDGE MAGNET IMAN NEVERA",
      "description": null,
      "searchQuery": "Monster Max"
    },
    "catalog": {
      "searchedCatalogId": "gameboy-monster-max",
      "candidateCatalogId": "gameboy-monster-max",
      "alternatives": []
    },
    "subject": {
      "identity": "MONSTER MAX NINTENDO GAME BOY FRIDGE MAGNET IMAN NEVERA",
      "platform": "gameboy",
      "edition": null,
      "physicalVariant": null
    },
    "images": [
      {
        "index": 1,
        "url": "https://i.ebayimg.com/images/g/x4gAAOSwGB1f~DO2/s-l1600.webp",
        "originalUrl": "https://i.ebayimg.com/images/g/x4gAAOSwGB1f~DO2/s-l1600.webp",
        "hash": null
      }
    ],
    "originalImages": [
      {
        "index": 1,
        "url": "https://i.ebayimg.com/images/g/x4gAAOSwGB1f~DO2/s-l1600.webp",
        "originalUrl": "https://i.ebayimg.com/images/g/x4gAAOSwGB1f~DO2/s-l1600.webp",
        "hash": null
      }
    ],
    "productGraph": {
      "nodes": [],
      "relations": []
    },
    "observations": [],
    "identifiers": [],
    "regional": {
      "targetRegion": "PAL Europa",
      "detectedRegion": "PAL Europa",
      "marketBinding": "UNBOUND",
      "evidence": [],
      "packagingLanguages": [],
      "distributors": [],
      "ratingSystems": []
    },
    "condition": {
      "bucket": "unknown",
      "confidence": null,
      "evidence": [],
      "manualExpected": true,
      "originalContentsExpected": [
        "manual"
      ]
    },
    "price": {
      "amount": 3.9,
      "shipping": null,
      "currency": "EUR",
      "estimatedTotalToSpain": null
    },
    "confidence": 0.9,
    "conflicts": [],
    "confirmed": [
      "candidate_identity",
      "platform_candidate"
    ],
    "rejected": [],
    "uncertain": [
      "identity",
      "market_region",
      "condition"
    ],
    "evidenceGaps": [
      {
        "field": "MARKET_REGION",
        "code": "MISSING_MARKET_PROOF",
        "missingProof": "No market-bound physical or distributor evidence.",
        "recommendedSourceTypes": [
          "EXACT_PHYSICAL_PHOTO",
          "DISTRIBUTOR"
        ]
      },
      {
        "field": "CONDITION",
        "code": "MISSING_COMPONENT_PHOTO",
        "missingProof": "Visible contents do not support a condition bucket.",
        "recommendedSourceTypes": [
          "EXACT_PHYSICAL_PHOTO"
        ]
      },
      {
        "field": "CANONICAL_IDENTITY",
        "code": "MISSING_COMPONENT_BINDING",
        "missingProof": "No component-level observations reached the queue.",
        "recommendedSourceTypes": [
          "LISTING_IMAGES"
        ]
      }
    ]
  },
  {
    "schemaVersion": 1,
    "reviewItemId": "4bf4e0b7299441413507",
    "queueVersion": "2026-09-09T17:51:46Z",
    "inputHash": "acf849459293b59446ed44abd9f6001a4518f4ec88cd766238ee974d188f8e5c",
    "evidenceHash": "b7d70c18552f6cdc408e490a1073ad79cc2b1a839bafd779059fc8b2ec557e2d",
    "source": "ebay-es",
    "capturedAt": null,
    "reason": "non_game",
    "triageBucket": null,
    "listing": {
      "id": "v1|297478441978|0",
      "url": "https://www.ebay.es/itm/297478441978?_skw=Super+Mario+Land+2&hash=item454318cbfa:g:l58AAeSwoNBoeoug&amdata=enc%3AAQALAAAA8ACCtXRWQnOEpyOqnQQ8KGZm2gFUM7QRsL2jgMyHb7nBMhkETnlQ%2FfB6YQ8hegOB4i9pjCpyW5EzIsmgBJ36HQCAkROnx53mTl4hBEoyWWXJs%2F11NwWXD%2BcwjqDevcIpw7N1X4bF397citHkjxX52sFzHHVP3oYHf5Hh2lBkpQ%2FnTdh2cwhPUtNAUMS%2FdbMpkKuVvLdFWazKhFr%2FandhRkPK4tEMspzmNkY1PDSh8Null7Y5EOmB1WJw4yByoJ%2FmI9esOXpG5pkuiiH74dagoKmHybM9c2hCMTT8Ql%2Fl%2FfQ%2BYDxOT18hvStraenMvt%2BIog%3D%3D",
      "title": "Manual Super Mario Land 2 6 Golden Coins Nintendo Gameboy Game Boy Dmg-Mq-Fah-1",
      "description": null,
      "searchQuery": null
    },
    "catalog": {
      "searchedCatalogId": "gameboy-es-super-mario-land-2",
      "candidateCatalogId": "gameboy-es-super-mario-land-2",
      "alternatives": []
    },
    "subject": {
      "identity": "Manual Super Mario Land 2 6 Golden Coins Nintendo Gameboy Game Boy Dmg-Mq-Fah-1",
      "platform": "gameboy",
      "edition": null,
      "physicalVariant": null
    },
    "images": [
      {
        "index": 1,
        "url": "https://i.ebayimg.com/images/g/l58AAeSwoNBoeoug/s-l1600.webp",
        "originalUrl": "https://i.ebayimg.com/images/g/l58AAeSwoNBoeoug/s-l1600.webp",
        "hash": null
      }
    ],
    "originalImages": [
      {
        "index": 1,
        "url": "https://i.ebayimg.com/images/g/l58AAeSwoNBoeoug/s-l1600.webp",
        "originalUrl": "https://i.ebayimg.com/images/g/l58AAeSwoNBoeoug/s-l1600.webp",
        "hash": null
      }
    ],
    "productGraph": {
      "nodes": [],
      "relations": []
    },
    "observations": [],
    "identifiers": [],
    "regional": {
      "targetRegion": "PAL España",
      "detectedRegion": "PAL España",
      "marketBinding": "UNBOUND",
      "evidence": [],
      "packagingLanguages": [],
      "distributors": [],
      "ratingSystems": []
    },
    "condition": {
      "bucket": "game_manual",
      "confidence": null,
      "evidence": [],
      "manualExpected": null,
      "originalContentsExpected": []
    },
    "price": {
      "amount": 12,
      "shipping": null,
      "currency": "EUR",
      "estimatedTotalToSpain": null
    },
    "confidence": null,
    "conflicts": [],
    "confirmed": [
      "candidate_identity",
      "platform_candidate",
      "condition"
    ],
    "rejected": [],
    "uncertain": [
      "identity",
      "market_region"
    ],
    "evidenceGaps": [
      {
        "field": "MARKET_REGION",
        "code": "MISSING_MARKET_PROOF",
        "missingProof": "No market-bound physical or distributor evidence.",
        "recommendedSourceTypes": [
          "EXACT_PHYSICAL_PHOTO",
          "DISTRIBUTOR"
        ]
      },
      {
        "field": "CANONICAL_IDENTITY",
        "code": "MISSING_COMPONENT_BINDING",
        "missingProof": "No component-level observations reached the queue.",
        "recommendedSourceTypes": [
          "LISTING_IMAGES"
        ]
      }
    ]
  },
  {
    "schemaVersion": 1,
    "reviewItemId": "2a6afc6eda62de70cc2e",
    "queueVersion": "2026-09-09T17:51:46Z",
    "inputHash": "322112081955b012631a94aff776c757e71898df14786e95a613c3d68310a1f2",
    "evidenceHash": "34f9b648d5618b0b554c11a7f37c4482744ae32bb810a74a0ce611f6d8a7000c",
    "source": "ebay-es",
    "capturedAt": "2026-09-07T21:36:07Z",
    "reason": "estado_desconocido",
    "triageBucket": "manual_match",
    "listing": {
      "id": "v1|407058967122|0",
      "url": "https://www.ebay.es/itm/407058967122?_skw=Super+Hunchback&hash=item5ec69aea52:g:ZdgAAeSwBRxqToPw",
      "title": "GAME BOY Super Hunchback. Starring Quasimodo. PAL UKV. Como Nuevo",
      "description": null,
      "searchQuery": "Super Hunchback"
    },
    "catalog": {
      "searchedCatalogId": "gameboy-uk-super-hunchback",
      "candidateCatalogId": "gameboy-uk-super-hunchback",
      "alternatives": []
    },
    "subject": {
      "identity": "GAME BOY Super Hunchback. Starring Quasimodo. PAL UKV. Como Nuevo",
      "platform": "gameboy",
      "edition": null,
      "physicalVariant": null
    },
    "images": [
      {
        "index": 1,
        "url": "https://i.ebayimg.com/images/g/ZdgAAeSwBRxqToPw/s-l1600.webp",
        "originalUrl": "https://i.ebayimg.com/images/g/ZdgAAeSwBRxqToPw/s-l1600.webp",
        "hash": null
      },
      {
        "index": 2,
        "url": "https://i.ebayimg.com/images/g/xZ4AAeSw7EJqToPX/s-l1600.webp",
        "originalUrl": "https://i.ebayimg.com/images/g/xZ4AAeSw7EJqToPX/s-l1600.webp",
        "hash": null
      }
    ],
    "originalImages": [
      {
        "index": 1,
        "url": "https://i.ebayimg.com/images/g/ZdgAAeSwBRxqToPw/s-l1600.webp",
        "originalUrl": "https://i.ebayimg.com/images/g/ZdgAAeSwBRxqToPw/s-l1600.webp",
        "hash": null
      },
      {
        "index": 2,
        "url": "https://i.ebayimg.com/images/g/xZ4AAeSw7EJqToPX/s-l1600.webp",
        "originalUrl": "https://i.ebayimg.com/images/g/xZ4AAeSw7EJqToPX/s-l1600.webp",
        "hash": null
      }
    ],
    "productGraph": {
      "nodes": [],
      "relations": []
    },
    "observations": [],
    "identifiers": [],
    "regional": {
      "targetRegion": "PAL Europa",
      "detectedRegion": "PAL UK/ENG",
      "marketBinding": "UNBOUND",
      "evidence": [],
      "packagingLanguages": [],
      "distributors": [],
      "ratingSystems": []
    },
    "condition": {
      "bucket": "complete",
      "confidence": null,
      "evidence": [],
      "manualExpected": true,
      "originalContentsExpected": [
        "manual"
      ]
    },
    "price": {
      "amount": 245,
      "shipping": null,
      "currency": "EUR",
      "estimatedTotalToSpain": null
    },
    "confidence": 0.9,
    "conflicts": [],
    "confirmed": [
      "candidate_identity",
      "platform_candidate",
      "condition"
    ],
    "rejected": [],
    "uncertain": [
      "identity",
      "market_region"
    ],
    "evidenceGaps": [
      {
        "field": "MARKET_REGION",
        "code": "MISSING_MARKET_PROOF",
        "missingProof": "No market-bound physical or distributor evidence.",
        "recommendedSourceTypes": [
          "EXACT_PHYSICAL_PHOTO",
          "DISTRIBUTOR"
        ]
      },
      {
        "field": "CANONICAL_IDENTITY",